name,free_returns,items_sold,price,shipping,status
New Invicta Men's 50mm Pro Diver Black Dial Christmas Green Silicone Strap Watch,True,,9999,999,Brand New
American Exchange Men's Brown Leather Strap Watch 44mm Gift Set,False,,1999,0,Brand New
New Blue-tooth Smart Watch & Phone with Camera Touch Screen Sleep Monitor ,True,,1999,0,Brand New
Invicta Marvel Punisher Chronograph Limited Black Stainless Steel 48mm Watch New,True,0,17999,0,Brand New
Fashion Sport Men's Stainless Steel Case Leather Band Quartz Analog Wrist Watch,False,2651,299599,0,Brand New
New ListingVintage Omega Gold Wristwatch,False,,3000,364,Pre-Owned
Men's Watch Mesh Belt Business Minimalist Ultra Thin Watches Stainless Steel NEW,False,,499609,0,Brand New
Waterproof Men's Military Tactical LED Digital Sports Watch Backlight Wristwatch,False,,1192,0,Brand New
New Listingvintage omega seamaster automatic mens watch used,False,,19900,800,Pre-Owned
Fashion Men Waterproof Watch Anti-scratch Stainless Steel Quartz Male Wristwatch,True,,1698,0,Brand New
CASIO MEN'S GOLD TONE STAINLESS STEEL DIGITAL WATCH A168WG,False,,3999,0,Brand New
Chronograph Men's Digital Army Military Sport Quartz Analog Waterproof Watch US,True,,1599,0,Brand New
4 Men's Mechanical Watches,False,,500,1260,Pre-Owned
Waterproof Men's Watch Stainless Steel Quartz Luminous Classic Watches,True,91,2299,0,Brand New
Ed Hardy Men's Shiny Gold Metal Alloy Bracelet Watch 42mm Gift Set,False,,1999,0,Brand New
Ed Hardy Men's Black Textured Silicone Strap Watch 48mm Gift Set,False,,1999,0,Brand New
Invicta Aviator Quartz Black Dial Men's Watch 37032,True,41,4318,0,Brand New
Casio Men's Quartz Multifunction Silver-Tone Bracelet 42mm Watch AE1200WHD-1A,True,0,3099,0,Brand New
New ListingVintage Rado DiaMaster 10 Tungsten Case Automatic Men's Day Date Watch 40x36.5mm,True,,125,1175,Pre-Owned
Fashion Men's Sports Watch LED Large Digital Waterproof Multifunction Wristwatch,True,,1348,0,Brand New
New ListingRolex Cellini 6631 Black Dial Solid 18K Wristwatch,True,0,680000,0,Pre-Owned
Waterproof Men's Watch Stainless Steel Quartz Analog Ultra Thin Business Luxury,True,,948,0,Brand New
New ListingGUCCI 102 G Series Diamond Case Leather Quartz Women's Watch 14 mm,True,,1050,1175,Pre-Owned
Casio Men's Quartz Illuminator Alarm Chronograph 36mm Watch A168W-1,True,0,2449,0,Brand New
Men's Watch Relojes De Hombre Stainless Steel Quartz Luminous Classic Watches,True,,1288,0,Brand New
Citizen Eco-Drive Men's Ion Plated Chronograph 45mm Watch AT2447-01E,True,0,11099,0,Refurbished
Invicta 52mm Men's PRO DIVE SCUBA Chronograph BLUE FIBER GLASS DIAL Blue Watch,True,0,8999,995,Brand New
New ListingVINTAGE LOT OF 3 BULOVA WATCHES WOODY ACCUTRON DUCHESS BAND ,False,,9900,600,Pre-Owned
Ed Hardy Men's Matte Black Silicone Strap Watch 46mm,False,0,1999,0,Brand New
Men's Watch Relojes De Hombre Stainless Steel Quartz Luminous Classic Watches,True,,2299,0,Brand New
Men's Army Sport Digital Wrist Watch Quartz Wrist Date Waterproof Military,True,,1299,0,Brand New
Fashion Sport Men's Women's Black Silicone Jelly Alloy Quartz Analog Wrist Watch,True,339,619,0,Brand New
Waterproof MEGIR Men's Stainless Steel Analog Sports Quartz Military Wrist Watch,True,,1398,0,Brand New
Waterproof Men Watch Stainless Steel Quartz Classic Business Luminous Wristwatch,True,,1448,0,Brand New
New ListingEterna Wrist Watch,False,,175,500,Pre-Owned
Mens Military Stainless Steel Date Quartz Analog Army Casual Dress Wrist Watches,False,,499,0,Brand New
New ListingVintage Gruen Watch - Rose Gold Filled - 1940s,False,,99,500,Pre-Owned
Seiko Series 5 Automatic Black Dial Men's Watch SNK809K1,True,410,10599,0,Brand New
Luxury Men's Quartz Watch Stainless Steel Analog Ultra Thin Waterproof Business,False,36,1048,0,Brand New
Stylish Men Women Analog Quartz Wrist Watch Stainless Steel Band Dress Watches,False,,8541519,0,New (Other)
2002 Stainless Steel Rolex Mod. 16220 DateJust Jubilee Bracelet Blue Dial Watch,False,0,395000,0,Pre-Owned
Invicta Men's Watch Pro Diver Quartz Dive Blue Dial Silver Tone Bracelet 9204OB,True,0,5229,0,Brand New
New ListingVintage LeCoultre & Movado Hand Wind Men's Watches,True,,10359,995,Pre-Owned
Military Watch Nylon Band Quartz Analog Wristwatch Soldier Luminous Watches,False,56,257,22,New (Other)
Seiko 5 SNKL23 Automatic Day-Date Black Dial Stainless Steel Mens Watch SNKL23K1,True,0,9325,0,Brand New
New ListingOris 7721 Thelonious Monk Ltd Ed 248/1000 Auto Steel Strap Wristwatch,False,,686,0,Pre-Owned
FNGEEN Waterproof Men's Watch Stainless Steel Quartz Luminous Classic Business,True,,1198,0,Brand New
"1970's ""Vintage Japan"" ""SEIKO 5. Automatic Sky Blue Classic Day Date Men's Watch",False,21,5900,400,Pre-Owned
New Listingrolex daydate 36mm READ DISCRIPTION,False,,57000,975,Pre-Owned
Waterproof Men Luxury Watch Automatic Mechanical Classic Stainless Steel Watches,True,,2398,0,Brand New
Men Quartz Watch Relojes De Hombre Minimalist Ultra Thin Stainless Steel Watches,True,,1598,0,Brand New
New ListingVintage Illinois Wrist Watch - Blackstone Etched Dial,False,,99,500,Pre-Owned
New Invicta Men 50mm PRO DIVER AUTOMATIC NH35A Charcoal Tritium Dial Black Watch,True,0,10999,999,Brand New
Waterproof Digital Sports Watch Military Tactical Men LED Backlight Wristwatch,False,160,1048,0,Brand New
Rolex Oyster Perpetual Date Watch Case Men Genuine 34mm Bezel Parts 1500,False,0,89900,0,Pre-Owned
Seiko Men's Series 5 Automatic Black Dial Watch - SNKL45K1 NEW,True,0,9228,0,Brand New
New ListingMens Fossil Watch,False,,1140,998,Pre-Owned
Men's Watch Reloj De Hombre Sports Style Silicone Rubber Watches Chronograph New,True,,2498,0,Brand New
Seiko Quartz LC Chronograph Watch,False,,125,1260,Pre-Owned
Casio Men's Quartz 8-Digit Calculator Resin Band 35mm Watch CA53W-1,True,0,2350,0,Brand New
Bulova Men's Quartz Date Indicator Blue Silicone Band 43mm Watch 98B341,True,312,8499,0,Brand New
Luxury Men's Automatic Mechanical Stainless Steel Watch Business Hollow Skeleton,True,,2248,0,Brand New
Business Men Stainless Steel Wristwatch Leather Strap Automatic Mechanical Watch,False,132,73199,177,Brand New
Men's Watch Relojes De Hombre Stainless Steel Quartz Luminous Classic Watches,True,,1589,0,Brand New
Invicta PRO DIVER CHRONOGRAPH Silver Black Dial OCEAN VOYAGE SS Men Watch,True,0,7989,999,Brand New
NEW!! Invicta Pro Diver Champagne Dial Gold-tone Roman Numerals Mens Watch 16739,True,0,6435,0,Brand New
G-Shock Power Trainer Analog-Digital Shock Resistant Blue Men Watch GBA800UC-2A,True,334,9999,0,Brand New
Men's Sports Watch Relojes De Hombre Military Waterproof Luminous Silicon Strap ,True,,2599,0,Brand New
Waterproof Men Watch Relojes De Hombre Stainless Steel Quartz Classic Wristwatch,True,,1348,0,Brand New
New Fashion Geneva Women Leather Band Stainless Steel Quartz Analog Wrist Watch,True,,699,0,Brand New
SMAEL FASHION Military Sport Watch Men's Digital Analog Waterproof Wrist Watches,False,,1399,0,Brand New
CURREN Military Men's Watch Sport Chronograph Leather Infantry Reloj Para Hombre,True,,2499,0,Brand New
Luxury Men's Mechanical Wrist Watch Brown Leather Strap Retro Design Skeleton,True,,2498,0,Brand New
New Men's Watch Waterproof Luminous Calendar Quartz Wrist Watch,False,0,21422236,0,Brand New
Fashion Ladies Wrist Watches Watch Quartz Analog Women Girl Steel Casual Gifts..,True,,495,0,Brand New
Shop on eBay,False,,2000,,Brand New
Waterproof Digital Sports Watch Military Tactical LED Backlight Wristwatch Men,True,,989,0,Brand New
SKMEI Men's Digital Army Military Sport Quartz Analog Chrono Waterproof Watch US,True,,1389,0,Brand New
Military Mens Automatic Mechanical Watch White Dial Wrist Steel Date Analog Army,False,0,2940,0,Brand New
Ed Hardy Men's Shiny Gold Metal Alloy Bracelet Watch 46mm Gift Set,False,,1999,0,Brand New
Luxury Men's Mechanical Wrist Watch Brown Leather Strap Retro Design Skeleton,True,,2498,0,Brand New
Mens Watches Male Quartz Watch Casual Slim Mesh Steel Waterproof Sport,True,0,948957,0,Brand New
Invicta Women's IN-27434 Angel 38mm Quartz Watch,True,47,3699,0,Brand New
Men's Digital Army Military Sport Quartz Analog Chrono Waterproof Watch US,True,,1298,0,Brand New
CASIO DW5600E-1V Mens Classic GSHOCK Black Resin Digital Chronograph Sport Watch,True,190,4799,0,Brand New
Invicta Men PRO DIVER SCUBA CHRONOGRAPH ABALONE Dial 18K Gold Bracelet SS Watch,True,0,9979,999,Brand New
New Invicta Men 50mm PRO DIVER AUTOMATIC NH35A Blue Tritium Dial Blue Tone Watch,True,0,10999,999,Brand New
Invicta Men's Watch Elements Yellow Gold Plated Stainless Steel Bracelet 30335,True,0,2299,0,Brand New
Citizen Women's Quartz Crystal Accent Bezel Date Calendar 26mm Watch EU6060-55D,True,0,5099,0,Refurbished
CURREN Men Watch Top Brand Men Military Sport Wristwatch Leather Quartz Watches,False,,19572068,0,Brand New
Versus Versace Mens Gold 46 mm Bicocca Watch VSPHJ1721,True,,11900,0,Brand New
New Fashion Women Crystal Multilayer Leather Bracelet Quartz Analog Wrist Watch ,True,,666,0,Brand New
Waterproof Men Quartz Watch Relojes De Hombre Stainless Steel Classic Wristwatch,True,,998,0,Brand New
Classic Ladies Watch Fashion Quartz Analog Wristwatch Square Dial Watches Gift,False,,279,22,New (Other)
HOT Luxury Women's Fashion Watch Stainless Steel Band Analog Quartz Wrist Watch,False,236,499672,0,Brand New
"Casio MQ24-9B,   Men's Black Resin Watch, Analog, Water Resistant",True,0,1525,0,Brand New
Fashion Military Men's Sport Digital Quartz Analog Waterproof Wrist Watch US Sto,True,,13991549,0,Brand New
MEGIR Waterproof Men Military Quartz Stainless Steel Leather Analog Sports Watch,True,,12981398,0,Brand New
Waterproof Men's Watch Classic Stainless Steel Quartz Luminous Luxury Wristwatch,True,,1498,0,Brand New
Men's Army Military Luminous 24 Hours Dial Nylon Strap Date Quartz Wrist Watch,False,,1044,0,New (Other)
Men Date Digital Electronic Watch Army Military Sport Waterproof Male WristWatch,True,,1498,0,Brand New
Waterproof Gold Men's Watch Classic Stainless Steel Quartz Analog Business Gift,True,,1498,0,Brand New
Fashion Stainless Steel Luxury Sport Analog Quartz Men's Wrist Watch RE GOD| /n,False,,359389,0,Brand New
Calvin Klein Women's K9U23141 Wavy 32mm Black Stainless Steel Watch,True,146,3999,0,Brand New
Citizen Eco-Drive Women's Corso Date Calendar Blue Dial 28mm Watch EW2294-53L,True,0,9099,0,Refurbished
Military Royale Mens Watch Quartz Black Stainless Steel Fabric Date Display Army,False,0,1850,0,Brand New
Mens Leather Strap Quartz Watch Business Minimalist Ultra Thin Dial Watches NEW,True,,899,0,Brand New
 Seiko 5 Vintage Automatic Day-Date men's Watch Run Excellent ,True,0,4997,0,Refurbished
Bulova Maquina Men's Automatic Skeleton Dial Exhibition Back 46mm Watch 98A238,True,0,19999,0,Refurbished
Waterproof Men Watch Stainless Steel Quartz Luminous Classic Business Wristwatch,True,,1548,0,Brand New
Invicta Men's IN-34748 Speedway 52mm Quartz Chronograph Watch,True,108,6199,0,Brand New
Caravelle Men's Quartz Date Indicator Nylon Band 40mm Watch43B168,True,,3499,0,Refurbished
Waterproof Sports Watch Men Digital Wristwatch LED Electronic Male Watches SMAEL,True,,1199,0,Brand New
Citizen Eco-Drive Men's Chronograph Silver-Tone Bracelet 46mm Watch CA0719-53E,True,0,16799,0,Refurbished
2021 Top Men's Ultra Thin Minimalist Watch Slim Mesh Belt Stainless Steel Quartz,False,126,599,0,Brand New
Men's Classic Stainless Steel Quartz Luminous Watch Luxury Waterproof Wristwatch,True,,1455,0,Brand New
Invicta Men's 50mm BOLT Chronograph BLUE DIAL Silver Tone Stainless Steel Watch,True,0,13999,999,Brand New
Men Military Wrist Watch Army Green Analog Digital Quartz Nylon Canvas US Stock,True,625,1556,0,Brand New
Luxury Men's Watch LED Sports Date Digital Bracelet Waterproof Quartz Wristwatch,True,,1198,0,Brand New
Casio G-Shock DW-5600-BB Men's Watch Digital Display Quartz Resin watch,False,62,4999,0,Brand New
Tissot Men's T0864071106100 Luxury 41mm Automatic Watch,True,87,26499,0,Brand New
Invicta Men's Watch Pro Diver Quartz Blue Dial Two Tone Bracelet 30616,True,0,6299,0,Brand New
Men Casual Stainless Steel Band LCD Digital Wrist Watch Sport Square Quartz|,False,81,349,0,Brand New
Relojes Hombre Luxury Chronograph Mens Watch Waterproof Military Leather Watches,True,,2599,0,Brand New
Waterproof Men's Military Tactical LED Digital Sports Watch Backlight Wristwatch,True,,778,199,Brand New
Trendy Men Ultra-Thin Minimalist Watch Slim Leather Strap Stainless-Steel Quartz,False,,474,0,New (Other)
NEW Men’s Military Stainless Steel Quartz Analog Army Casual Dress Wrist Watches,False,,499,0,Brand New
Invicta Pro Diver Quartz Blue Dial Men's Watch 37740,True,0,5199,0,Brand New
Invicta Men's 50mm BOLT Chronograph BLACK DIAL Gold Tone Stainless Steel Watch,True,0,11249,999,Brand New
FNGEEN Waterproof Men Quartz Analog Wrist Watch Classic Stainless Steel Business,True,,1298,0,Brand New
Men's Gold Quartz Watch Waterproof Classic Stainless Steel Business Gift,True,,1379,0,Brand New
Bulova Men's Quartz Chronograph Date Indicator Blue Dial 43mm Watch 96B306,True,,11799,0,Brand New
Luminous Men's Watch Relojes De Hombre Stainless Steel Quartz Classic Waterproof,True,,1398,0,Brand New
Gold Men's Watch Relojes De Hombre Waterproof Stainless Steel Luminous Classic,True,,1398,0,Brand New
Waterproof Gold Men's Quartz Watch Classic Stainless Steel Business Wristwatch,True,,1298,0,Brand New
Men Military Army Mens Date Canvas Strap Analog Quartz Sport Wrist Watch Gifts,False,,450,0,Brand New
Business Sport Men's Stainless Steel Case Leather Band Quartz Analog Wrist Watch,False,139,399499,0,Brand New
Tissot Men's T1014072203100 PR 100 39mm Automatic Watch,True,59,21499,0,Brand New
Casio G-Shock Men's Black Watch GSG-100-1A DR Mudmaster Tough Solar ✅✅✅✅✅✅✅✅✅✅✅✅,True,0,19998,0,Brand New
Tissot Men's T1175091605200 Heritage 27mm Quartz Watch,True,,15900,0,Brand New
Caravelle Men's Quartz Black Dial Calendar Sport Black Rubber 42mm Watch 43B154,True,0,3199,0,Refurbished
Waterproof Men Stainless Steel Quartz Watch Classic Luminous Business Wristwatch,True,,1598,0,Brand New
Citizen Eco-Drive Men's Promaster Calendar Silver Tone Watch 42mm BN0211-50E,True,0,16799,0,Refurbished
Waterproof Men Watch Classic Stainless Steel Quartz Luminous Business Wristwatch,True,,1398,0,Brand New
FNGEEN Waterproof Gold Men Quartz Watch Classic Stainless Steel Analog Business,True,,14481498,0,Brand New
Calvin Klein Women's K8Q331L2 Posh 32mm Quartz Watch,True,311,3899,0,Brand New
Digital Watch Men's Women's Sport Band Wrist LED Waterproof Chronograph Repeater,True,515,11581279,0,Brand New
Kids Digital Electronic Watch Waterproof Children Boys Girls Sports LED Watches,True,210,799,0,Brand New
Citizen Eco-Drive Men's Date Indicator Grey Dial 41mm Watch BM7251-53H,True,0,9999,0,Refurbished
Men's Watch Gold Relojes De Hombre Classic Stainless Steel Quartz Diamond Watch,True,,1199,0,Brand New
Citizen Eco-Drive Men's Axiom Blue Dial Bracelet 41mm Watch BJ6510-51L,True,0,8499,0,Refurbished
Shop on eBay,False,,2000,,Brand New
Men's Women Rhinestone Dial Date Waterproof Luxury Stainless Steel Wrist Watch,True,,15202659,0,New (Other)
Men's Rotating Starry Sky Automatic Mechanical Watch Luminous Business Fashion,False,44,5624,0,Brand New
Mens Watch Mechanical White Dial Black Leather Strap Auto Date Analog Luxury,False,0,3780,0,Brand New
Men Army Sports Fashion Two Time Zones Big Dial Leather Strap Quartz Wrist Watch,False,,1599,0,New (Other)
Tissot Couturier Black Dial Black Leather Men's Analog-Digital Watch,True,60,15271,0,Brand New
Women Watches Starry Sky Ladies Watch Casual Leather Sports Quartz Wristwatch,False,,255,110,Brand New
Stainless Steel Luxury Sport Analog Quartz Modern Men Fashion Wrist Watch 2022,False,,658,0,Brand New
Invicta Mens 12847 Specialty Blue Dial Blue Polyurethane Watch,True,0,2965,0,Brand New
2022Men Watches Skeleton Automatic Waterproof Watch Luxury Mechanical Wristwatch,False,,1689,0,Brand New
"Casio MDV106-1AV, Duro,Men's Black Resin Watch, 200 Meter WR, Anti-Reverse Bezel",True,3265,5280,0,Brand New
Tissot Ballade Automatic Chronometer Silver Dial Men's Watch T108.408.33.037.00,True,139,35090,0,Brand New
NEW AUTHENTIC FOSSIL FLYNN SILVER BROWN LEATHER CHRONOGRAPH BQ2688 MEN'S WATCH,True,,6999,0,Brand New
Invicta Men's 40mm Pro Diver AUTOMATIC NH35A BLACK DIAL Silver Watch,True,0,8499,995,Brand New
Men's Leather Gold Watch & Stackable Set,False,0,1999,0,Brand New
Men's Fashion Stainless Steel Belt Sport Business Quartz Watch US Ship,False,,631,0,Brand New
Chronograph Men's Digital Sport Watch LED Large Army Military Quartz Waterproof,True,,1348,0,Brand New
Timex Marathon Men's TW5M21000 Chronograph Gray Sport Digital Indiglo Watch,True,,1550,0,Brand New
New Movado Museum Yellow Gold Tone Black Dial Leather Strap Men's Watch 0607195,True,65,29200,0,Brand New
Invicta Men's 50mm PRO DIVER AUTOMATIC NH35A FULL LUME Blue Tritium Dial Watch,True,0,10999,999,Brand New
NEW AUTHENTIC FOSSIL BANNON MULTIFUNCTION CHRONOGRAPH SILVER BQ2490 MEN'S WATCH,True,,6999,0,Brand New
Waterproof Men Quartz Watch Classic Stainless Steel Luminous Business Wristwatch,True,,13481398,0,Brand New
Invicta 12411 Men's Pro Diver Silver Dial Red & Black Rubber Strap Chrono Watch,True,0,6599,0,Brand New
Tissot Gent XL Quartz Green Dial Brown Leather Men's Watch T116.410.36.097.00,True,80,10400,0,Brand New
Invicta Men's 30936 Pro Diver Quartz Chronograph Black Dial Watch,True,0,6157,0,Brand New
Citizen Eco-Drive Men's Chronograph Date Indicator 43mm Watch CA4377-53H,True,0,16799,0,Refurbished
Tissot Men's T0634091101800 Tradition Thin 38mm Quartz Watch,True,83,13999,0,Brand New
Men's Watch Relojes De Hombre Gold Stainless Steel Quartz Classic Small Dial,True,316,1649,0,Brand New
Thomas Earnshaw Men's ES-8169-04 Longcase 43mm Silver Leather Watch,True,0,9999,0,Brand New
Men's Punk Style Black Wide Leather Watch Three Leather Straps Cuff Wristwatch,True,491,1499,0,New (Other)
Men's Luxury Iced Watch Bling Full Rhinestone Date Luminous Quartz Wristwatch,False,,14242374,0,New (Other)
Large Dial Planet Men and Women Couple Watch Watch Non-Mechanical,False,17,3643,0,Brand New
SMAEL Digital Watches Men LED Electronic Wristwatches Fashion Sport Quartz Watch,False,,1357,0,Brand New
Bulova Men's Sutton Quartz Six-Hand Chronograph Gray Dial 44mm Watch 98B335,True,0,18799,0,Refurbished
Invicta Women's IN-35848 Pro Diver 36mm Automatic Watch,True,54,4899,0,Brand New
Invicta 30334 Men's Elements Stainless Steel Bracelet Watch,True,0,1995,0,Brand New
Father' Gift Windproof Jet Torch Gas Butane Cigarette Lighter Bird Quartz Watch,False,1121,10891199,0,Brand New
Casio Men's Quartz Illuminator Calculator Black Resin Band 41mm Watch DBC32-1A,True,0,3699,0,Brand New
Luxury Men's Quartz Watch Business Stainless Steel Analog Ultra Thin Waterproof,True,,1598,0,Brand New
Automatic Mechanical Luminous Canvas Rubber Band Men's Watch,False,32,4692,0,Brand New
New ListingSeiko 5 Tuna Mod Automatic 7s26,False,,11900,0,Pre-Owned
CASIO DW9052-1V Mens Classic G-SHOCK Black Resin Digital Chronograph Sport Watch,True,364,4888,0,Brand New
SBTR027 Seiko Spirit Chronograph Quartz Men's Watch Stainless Steel from Japan,True,0,12700,0,Brand New
Caravelle Men's Quartz Navy Dial Calendar Sport Black Leather 42mm Watch 43B155,True,,3099,0,Refurbished
New Projects Reveal Black Stainless Steel Watch Leather Band Daniel Will-Harris,False,,5900,0,New (Other)
MICHAEL KORS MK5869 Camille Silver-Tone Crystal Pave Glitz Dial Ladies Watch,True,,12326,0,Brand New
Ingersoll Men's Trenton Radiolite Quartz Watch 44 mm Black Leather - I03201 NEW,True,0,5900,0,Brand New
LED Digital Screen Wrist Sport Watch For Men Women Unisex Boys Girls Kids,False,138,73214,177,Brand New
CASIO DW5600E-1V Mens Classic GSHOCK Black Resin Digital Chronograph Sport Watch,True,1440,4788,0,Brand New
Tissot Le Locle Automatic Black Dial Men's Watch T006.428.11.052.00,True,91,24900,0,Brand New
Men's Army Military Luminous 24 Hours Dial Nylon Strap Date Quartz Wrist Watch,True,,999,0,Brand New
Invicta Men's 52mm Pro Diver Aqua Hydro Plated Graffiti Multicolor Chrono Watch,True,0,9999,999,Brand New
"Seiko 5 Sports 42.5mm 24-Jewel Men's Automatic Watch, Stainless Steel",False,0,16500,0,New (Other)
Men's Watch Waterproof Classic Relojes De Hombre Stainless Steel Quartz Luminous,True,,1348,0,Brand New
Men's Citizen Promaster Diver's 200 Automatic Hack Watch NY0085-86E,True,0,19160,0,Brand New
SWATCH x OMEGA BIOCERAMIC MOONSWATCH Collection Moonswatch Series 10ea,False,0,3899874999,0,Brand New
Luxury Men's Watch Relojes De Hombre Business Stainless Steel Quartz Waterproof,True,,1098,0,Brand New
Caravelle Women's Quartz Silver-Tone Date Indicator Black Dial 32mm Watch 43M115,True,,3099,0,Refurbished
Waterproof Kids Digital Electronic Watch Children Boys Girls Sports LED Watches,True,,948998,0,Brand New
"Casio DW5600E-1V, G-Shock 200 Meter Watch, Chronograph, Illuminator, Alarm",True,1993,4988,0,Brand New
Casio Men's Watch G-Shock Alarm Ana-Dig White Dial Black Resin Strap GA100BW-1A,True,0,7994,0,Brand New
Luxury Men's Stainless Steel Gold Tone Skeleton Automatic Mechanical Wrist Watch,True,,2148,0,Brand New
Citizen Eco-Drive Men's World Time Perpetual Calendar 44mm Watch BX1010-02E,True,0,13399,0,Refurbished
Casio Men's Watch G-Shock Black Resin Strap Anti-Magnetic Ana-Digital GA100-1A1,True,2191,7234,0,Brand New
Business Classic Men's Watch Gold Stainless Steel Quartz Luminous Wristwatch USA,False,,1669,0,Brand New
Mens Leather Watch Relojes Hombre Chronograph Luminous Business Quartz Watches,True,,2799,0,Brand New
Citizen Eco-Drive Bianca Women's Silver-Tone Blue Dial 22x28mm Watch EW5551-56N,True,0,10899,0,Refurbished
NEW AUTHENTIC FOSSIL MEN'S WATCH BANNON MULTIFUNCTION GOLD CHRONOGRAPH BQ2588,True,29,6899,0,Brand New
Citizen Eco-Drive Promaster Sailhawk Yacht Timer Men's 44mm Watch JR4068-01E,True,0,17299,0,Refurbished
Luxury Mens Stainless Steel Gold Tone Skeleton Automatic Mechanical Wrist Watch,True,,2248,0,Brand New
Caravelle Men's Quartz Date Indicator Silver-Tone 41mm Watch 43B151,True,,3399,0,Refurbished
NEW Invicta 43mm Men's Pro Diver SWISS GMT Quartz Blue Dial TT Bezel Diver Watch,True,0,4999,999,Brand New
Bulova Men's Classic Quartz Rotating Bezel Gold Tone Accents 43mm Watch 98B329,True,61,11299,0,Brand New
Invicta Men's Watch Pro Diver Quartz Blue Dial Two Tone Steel Bracelet 8935,True,0,5099,0,Brand New
Men's Watch Mesh Belt Business Minimalist Ultra Thin Watches Stainless Steel NEW,False,30,649,0,Brand New
Vintagea seiko 5 Automatic Day/Date Men's Wrist Watch Working Good,True,0,3900,0,Refurbished
Shop on eBay,False,,2000,,Brand New
Military Men Watch Quartz Black Stainless Steel Nylon Fabric Date Display Casual,True,0,1401,99,Brand New
Soldier Luminous Wristwatch Nylon Band Watch Fashion Quartz Analog Watches Gift,False,,317,0,Brand New
VINTAGE CITIZEN AUTOMATIC GREEN DIAL DAY DAY MEN'S WRIST WATCH GOOD CONDITION,True,0,3677,0,Refurbished
Seiko 5 Sports Green Nylon Strap Watch - SRPD91,False,0,15999,0,Pre-Owned
"Casio AE1500WH-5AV, Chronograph Watch, Illuminator,  5 Alarms, 10 Year Battery",True,228,2600,0,Brand New
New Ladies Wristwatches Luminous Women Watches Casual Leather Strap Quartz Watch,False,,890,0,Brand New
New ListingFossil Twist,False,,9000,0,Pre-Owned
Mens Rolex Date Stainless Steel Watch Engine-Turned Index Bezel Silver Dial 1501,True,0,334398,0,Pre-Owned
Calvin Klein Men's KBH211C6 Bright 40mm Silver Dial Leather Watch,True,57,3299,0,Brand New
OLEVS Model 6898-g Mens Watches Waterproof Stainless Steel Luxury Wristwatch New,False,0,3099,0,Brand New
Calvin Klein Men's K4N211C1 Time 40mm Black Dial Leather Watch,True,,3999,0,Brand New
Nike Triax Analogue Super Sports Silver/Blue Watch Unisex 20-401 RARE,False,834,2255,1692,Brand New
New Invicta Mens 51mm BOLT Swiss Quartz Chronograph Blue Dial Gold Tone SS Watch,True,0,8499,999,Brand New
Waterproof Men Watch Stainless Steel Quartz Luminous Classic Wristwatch Business,False,,899,0,Brand New
Men's Gold Dial Skeleton Black Leather Mechanical Sport Army Wrist Watch Classic,True,0,2199,0,New (Other)
Metal Windproof Jet Torch Cigar Cigarette Gas Butane Lighter Quartz w/ Watch/LED,True,,1049,0,Brand New
2022 New Smart Watch Women Men Heart Rate For Phone Android Bluetooth Waterproof,False,10,1599,0,Brand New
Fashion Men Women Wrist Watch LED Backlight Crystal Quartz Silicone Band Sport,False,459,474,100,Brand New
Waterproof Gold Men's Quartz Watch Stainless Steel Business Classic Wristwatch,True,,1298,0,Brand New
"Casio AE1200WH-1AV, Chronograph Watch, Illuminator,  5 Alarms, 10 Year Battery",True,0,2425,0,Brand New
Casio Men's Quartz World Time Illuminator Silver-Tone 44mm Watch AE1000WD-1AV,True,0,2799,0,Brand New
Waterproof Men's Watch Luxury Stainless Steel Quartz Classic Business Wristwatch,True,,1298,0,Brand New
Victorinox Swiss Army Men's Watch Alliance Grey Dial Brown Leather Strap 241806,True,53,10099,0,Brand New
Men's Quartz Watch Stainless Steel Analog Waterproof Business Wristwatch Fashion,True,,1548,0,Brand New
New ListingSwiss Classic Men's Quartz Watch Jacques Lemans G-199,False,,6500,685,Pre-Owned
Silicone Leather Chronograph Men's Watch Luxury Quartz Watches Relojes De Hombre,True,42,2999,0,Brand New
Waterproof Men's Luxury Automatic Mechanical Classic Stainless Steel Wristwatch,True,,2148,0,Brand New
Invicta Men Pro Diver 24 Jewel Automatic NH35A 18K Gold Plate SS Champagne Watch,True,0,10999,995,Brand New
SMAEL Waterproof Sports Watch Men Digital Wristwatch LED Electronic Male Watches,False,,12871320,0,Brand New
OLEVS 2858 Waterproof Luminous Chronograph Quartz Stainless Steel Male Watch ,False,0,3000,0,Brand New
YOLAKO Classic Mens Stainless Steel Watch Business Casual Date Quartz Wristwatch,False,,854,0,New (Other)
