name,free_returns,items_sold,price,shipping,status
Omega X Swatch MoonSwatch Bioceramic - ANY COLOR - BRAND NEW ,True,23,5499082990,0,Brand New
Invicta Specialty Mechanical Black Dial Men's Watch 31309,True,119,4700,0,Brand New
Mens Watches Sports Wrist Boys Army Silicon Strap Quartz Cheap Men's Watch  HOT!,False,,342371,0,Brand New
"Casio AE1500WH-8BV, Chronograph Watch, Illuminator,  5 Alarms, 10 Year Battery",True,0,2600,0,Brand New
Waterproof Men Watch Relojes De Hombre Stainless Steel Quartz Classic Wristwatch,True,1076,1398,0,Brand New
Bulova Computron Men's Quartz Gold-Tone Digital LED Display 31mm Watch 97C110,True,0,14299,0,Refurbished
MEGIR Men's Quartz Stainless Steel Analog Waterproof Sports Military Wrist Watch,True,,1398,0,Brand New
Smart Watch Waterproof Heart Rate Sports Blood Pressure Fitness O2 Sleep Tracker,True,,29953095,0,Brand New
Citizen Eco-Drive Silhouette Women's Swarovski Crystal 29mm Watch EX1483-50D,True,0,8999,0,Refurbished
Citizen Promaster Diver Men's Eco Drive Watch - BN0150-10E NEW,True,0,18400,0,Brand New
Invicta Angel MOP Dial Interchangeable Leather Strap Ladies Watch 12544,True,109,6195,0,Brand New
Waterproof Men's Watch Relojes De Hombre Classic Stainless Steel Quartz Luminous,True,,11981298,0,Brand New
FNGEEN Waterproof Gold Men Watch Classic Stainless Steel Quartz Analog Business,True,,13481398,0,Brand New
Casio Men's Watch G-Shock G-Squad Quartz Ana-Digi Dial Black Strap GBD800-1B,True,505,7835,0,Brand New
Bulova Marine Star Silicone Automatic Mens Watch 98A225,False,49,22500,0,Brand New
Invicta Men's Watch Pro Diver Quartz Black Dial Silver Tone Steel Bracelet 30956,True,0,4998,0,Brand New
Vostok Amphibia 120512 Watch Scuba Dude Diver New US Seller,False,,12499,0,Brand New
Invicta Men's Watch Pro Diver Blue Dial Quartz Stainless Steel Bracelet 30610,True,0,5699,0,Brand New
Men's Military Sports Watch LED Screen Large Digital Face Waterproof Wristwatch,True,,1348,0,Brand New
"Casio MRW200H-2B2V, Men's Analog Black Resin Band, 100 Meter, Day/Date",True,0,2388,0,Brand New
New ListingVostok Komandirskie 431941 Automatic Russian Military Watch - USA SELLER,True,,7495,0,Brand New
Bulova Men's Phantom Quartz Crystal Embellished 42mm Watch 96A236,True,0,22199,0,Refurbished
Invicta Men's 28122 Aviator Quartz Chronograph Gold Dial Watch,True,0,7990,0,Brand New
Bulova Women's Crystal Accents Black Leather Band Quartz 32mm Watch 96L246,True,0,9799,0,Refurbished
Calvin Klein Completion Chronograph Quartz Black Dial Men's Watch KAM27141,True,70,6137,0,Brand New
Waterproof Men's Watch Classic Stainless Steel Quartz Analog Business Bracelet,True,,1298,0,Brand New
Casio Women's LTP-V007 Waterproof Stainless Steel/Leather Watch,False,25,23993299,1799,Brand New
Classic Men's Watch Waterproof Stainless Steel Quartz Business Sports Wristwatch,True,,1348,0,Brand New
New ListingInvicta Russian Diver Signature Collection Watch - Model #7188,False,,10000,985,Pre-Owned
Tissot Le Locle Automatic Black Dial Men's Watch T006.428.36.052.00,True,221,24771,0,Brand New
Caravelle Men's Quartz Calendar Watch 40mm 43B152,True,,2499,0,Refurbished
Invicta Men's Watch Pro Diver Black and Orange Bezel Silver Tone Bracelet 30621,True,0,5699,0,Brand New
SBTR017 Seiko Spirit Stainless Steel Chronograph Men`s Watch green dial JP,True,25,12700,0,Brand New
Bulova Sutton Men's Quartz Silver-Tone Date Display Blue Dial 40mm Watch 96B338,True,0,9999,0,Refurbished
New ListingVintage Bulova Mens 23 Jewels 10k Rolled Gold Plated Watch - no band,False,,12500,439,Pre-Owned
Waterproof Men's Watch Classic Stainless Steel Quartz Business Analog Wristwatch,True,,1148,0,Brand New
Kid Smart Watch Tracker Anti-Lost SOS Call Phone Touch Screen Camera GPS Tracker,False,65,10991199,0,Brand New
Fashion Women Luxury Stainless Steel Crystal Quartz Round Waterproof Wrist Watch,True,,848,0,Brand New
G-Shock Casio Men's GA-110LS-1A Watch Transparent Black/Orange,False,0,5599,0,Brand New
Rolex Mens Datejust 36mm 18k Yellow Gold & Steel ICED 2.50ct Diamonds Black Dial,True,0,829999,0,Pre-Owned
New ListingInvicta 48mm Disney Limited Edition GOOFY Gold Dial Chronograph Silicone Watch,True,,234,995,Brand New
Waterproof Men Watch Stainless Steel Quartz Luminous Classic Business Wristwatch,True,,998,0,Brand New
Casio Unisex Digital A168WEM-7VT Japan-Automatic Stainless Steel Watch Silver...,True,35,4800,0,Brand New
Wristwatch Waterproof Men's Watch Classic Stainless Steel Quartz Luminous Luxury,True,,1399,0,Brand New
